<?xml version="1.0" encoding="UTF-8"?>
<xs:schema xmlns:xs="http://www.w3.org/2001/XMLSchema">

  <xs:element name="book">
    <xs:complexType>
      <xs:sequence>
        <xs:element name="title" type="xs:string"/>
        <xs:element name="author" type="xs:string"/>
        <xs:element name="year" type="xs:gYear"/>
        <xs:element name="publisher">
          <xs:complexType>
          <xs:sequence>
              <xs:element name="name" type="xs:string"/>
              <xs:element name="country" type="xs:string"/>
              <xs:element name="founded" type="xs:gYear"/>
            </xs:sequence>
          </xs:complexType>
        </xs:element>
      </xs:sequence>
      <xs:attribute name="id" type="xs:ID" use="required"/>
      <xs:attribute name="genre" type="xs:string" use="required"/>
    </xs:complexType>
  </xs:element>

</xs:schema>